{
  "schema_version": "eventir/0.1",
  "event": {
    "type": "cold_holding_temperature_excursion",
    "title": "Zenodo 冷库开门与产品移入实验摘录",
    "domain_pack": "cold-holding-excursion-diagnostics/1.0.0",
    "occurred_at": {
      "start": "2024-09-04T10:05:00+02:00",
      "end": "2024-09-04T10:45:00+02:00"
    }
  },
  "subjects": [
    {
      "type": "cold_holding_unit",
      "label": "zenodo-15130001/cold-room",
      "attributes": {
        "site_id": "zenodo-15130001",
        "unit_id": "cold-room",
        "unit_type": "cold_room",
        "temperature_limit_c": 12,
        "minimum_excursion_minutes": 15,
        "maximum_sample_gap_minutes": 5,
        "sensor_tolerance_c": 1,
        "policy_reference": "测试阈值，仅用于验证解析与时间对齐"
      }
    }
  ],
  "claims": [],
  "evidence": [],
  "observations": [],
  "hypotheses": [],
  "contradictions": [],
  "unknowns": []
}
